{
  "type": "FeatureCollection",
  "numberMatched": 36,
  "numberReturned": 3,
  "features": [
    {
      "type": "Feature",
      "id": "2024-K04",
      "geometry": null,
      "properties": {
        "type": "dimension-member",
        "dimension:type": "temporal",
        "dimension:code": "2024-K04",
        "dimension:index": 3,
        "title": "2024-K04",
        "time": {"interval": ["2024-02-01", "2024-02-10"]},
        "dimension:start": "2024-02-01",
        "dimension:end": "2024-02-10"
      }
    },
    {
      "type": "Feature",
      "id": "2024-K05",
      "geometry": null,
      "properties": {
        "type": "dimension-member",
        "dimension:type": "temporal",
        "dimension:code": "2024-K05",
        "dimension:index": 4,
        "title": "2024-K05",
        "time": {"interval": ["2024-02-11", "2024-02-20"]},
        "dimension:start": "2024-02-11",
        "dimension:end": "2024-02-20"
      }
    },
    {
      "type": "Feature",
      "id": "2024-K06",
      "geometry": null,
      "properties": {
        "type": "dimension-member",
        "dimension:type": "temporal",
        "dimension:code": "2024-K06",
        "dimension:index": 5,
        "title": "2024-K06",
        "time": {"interval": ["2024-02-21", "2024-02-29"]},
        "dimension:start": "2024-02-21",
        "dimension:end": "2024-02-29"
      }
    }
  ],
  "links": [
    {"rel": "self", "href": "/dimensions/dekadal/items?limit=3&offset=3", "type": "application/geo+json"},
    {"rel": "collection", "href": "/dimensions/dekadal", "type": "application/json"},
    {"rel": "next", "href": "/dimensions/dekadal/items?limit=3&offset=6", "type": "application/geo+json"},
    {"rel": "prev", "href": "/dimensions/dekadal/items?limit=3&offset=0", "type": "application/geo+json"}
  ]
}
